{
  "$schema": "https://json-schema.org/draft/2020-12/schema",
  "$id": "https://aws.amazon.com/solutions/deepracer-on-aws/default-config.schema.json",
  "title": "DeepRacer on AWS default configuration",
  "type": "object",
  "additionalProperties": false,
  "required": ["$schema", "version", "common", "dynamoDB", "sageMaker", "userPool"],
  "properties": {
    "$schema": { "const": "./defaultConfig.schema.json" },
    "version": { "const": 1 },
    "common": {
      "type": "object",
      "additionalProperties": false,
      "required": ["defaultNamespace", "minEvaluationTrials"],
      "properties": {
        "defaultNamespace": { "type": "string", "pattern": "^[A-Za-z0-9][A-Za-z0-9_-]{0,63}$" },
        "minEvaluationTrials": { "type": "integer", "minimum": 1, "maximum": 1000 }
      }
    },
    "dynamoDB": {
      "type": "object",
      "additionalProperties": false,
      "required": ["baseTableName", "resourceIdLength"],
      "properties": {
        "baseTableName": { "type": "string", "pattern": "^[A-Za-z0-9_.-]{3,255}$" },
        "resourceIdLength": { "type": "integer", "minimum": 1, "maximum": 255 }
      }
    },
    "sageMaker": {
      "type": "object",
      "additionalProperties": false,
      "required": ["instanceCount", "instanceType", "instanceVolumeSizeInGB"],
      "properties": {
        "instanceCount": { "type": "integer", "minimum": 1, "maximum": 100 },
        "instanceType": {
          "type": "string",
          "enum": [
            "ml.c4.2xlarge",
            "ml.c4.4xlarge",
            "ml.c4.8xlarge",
            "ml.c4.xlarge",
            "ml.c5.18xlarge",
            "ml.c5.2xlarge",
            "ml.c5.4xlarge",
            "ml.c5.9xlarge",
            "ml.c5.xlarge",
            "ml.c5n.18xlarge",
            "ml.c5n.2xlarge",
            "ml.c5n.4xlarge",
            "ml.c5n.9xlarge",
            "ml.c5n.xlarge",
            "ml.c6i.12xlarge",
            "ml.c6i.16xlarge",
            "ml.c6i.24xlarge",
            "ml.c6i.2xlarge",
            "ml.c6i.32xlarge",
            "ml.c6i.4xlarge",
            "ml.c6i.8xlarge",
            "ml.c6i.xlarge",
            "ml.c7i.4xlarge",
            "ml.g4dn.12xlarge",
            "ml.g4dn.16xlarge",
            "ml.g4dn.2xlarge",
            "ml.g4dn.4xlarge",
            "ml.g4dn.8xlarge",
            "ml.g4dn.xlarge",
            "ml.g5.12xlarge",
            "ml.g5.16xlarge",
            "ml.g5.24xlarge",
            "ml.g5.2xlarge",
            "ml.g5.48xlarge",
            "ml.g5.4xlarge",
            "ml.g5.8xlarge",
            "ml.g5.xlarge",
            "ml.m4.10xlarge",
            "ml.m4.16xlarge",
            "ml.m4.2xlarge",
            "ml.m4.4xlarge",
            "ml.m4.xlarge",
            "ml.m5.12xlarge",
            "ml.m5.24xlarge",
            "ml.m5.2xlarge",
            "ml.m5.4xlarge",
            "ml.m5.large",
            "ml.m5.xlarge",
            "ml.m6i.12xlarge",
            "ml.m6i.16xlarge",
            "ml.m6i.24xlarge",
            "ml.m6i.2xlarge",
            "ml.m6i.32xlarge",
            "ml.m6i.4xlarge",
            "ml.m6i.8xlarge",
            "ml.m6i.large",
            "ml.m6i.xlarge",
            "ml.p3.16xlarge",
            "ml.p3.2xlarge",
            "ml.p3.8xlarge",
            "ml.p3dn.24xlarge",
            "ml.p4d.24xlarge",
            "ml.p4de.24xlarge",
            "ml.p5.48xlarge",
            "ml.r5.12xlarge",
            "ml.r5.16xlarge",
            "ml.r5.24xlarge",
            "ml.r5.2xlarge",
            "ml.r5.4xlarge",
            "ml.r5.8xlarge",
            "ml.r5.large",
            "ml.r5.xlarge",
            "ml.r5d.12xlarge",
            "ml.r5d.16xlarge",
            "ml.r5d.24xlarge",
            "ml.r5d.2xlarge",
            "ml.r5d.4xlarge",
            "ml.r5d.8xlarge",
            "ml.r5d.large",
            "ml.r5d.xlarge",
            "ml.t3.2xlarge",
            "ml.t3.large",
            "ml.t3.xlarge",
            "ml.trn1.2xlarge",
            "ml.trn1.32xlarge",
            "ml.trn1n.32xlarge"
          ]
        },
        "instanceVolumeSizeInGB": { "type": "integer", "minimum": 1, "maximum": 16384 }
      }
    },
    "userPool": {
      "type": "object",
      "additionalProperties": false,
      "required": ["baseName", "enableMFA", "enableSignups"],
      "properties": {
        "baseName": { "type": "string", "pattern": "^[A-Za-z0-9][A-Za-z0-9._-]{0,127}$" },
        "enableMFA": { "type": "boolean" },
        "enableSignups": { "type": "boolean" }
      }
    }
  }
}
